question,ranked_chunks
What are the main elevations and sub elevations of Tea growing area ?,"[b'# Immature Tea\n\nThe main stems and main branches of immature tea are susceptible to SHB. Protection of the main stem and main branches which give rise frame of the tea bush is vital.', b'# 3.3\n\nSesbania sesban is also recommended as a green manure crop for all elevations. This particular species is not a threat to tea as far as tea nematodes are concerned.', b'# 16.\n\n(1) All officers and servants of the Tea Shakthi main Project and Tea Shakthi Investment Project on the day immediately preceding the date of commencement of this Act, shall where such officers or servants consent to be employees of the Fund be deemed to be officers and servants of such Fund with effect from the date of commencement of this Act.\n\n(2) All movable and immovable properties of, the Tea Shakthi Main Project and Tea Shakthi Investment Project shall vest in the Fund. with effect from the date of commencement of this Act.\n\n(3) All contracts and agreements entered into by or with or on behalf of the Tea Shakthi Main Project or Tea Shakthi Investment Project and subsisting or having effect on the day immediately preceding the date of commencement of this Act, shall be deemed with effect from the date of commencement of this Act. to be contracts and agreements entered into by the Fund as fully and effective) as if, the Fund had been a party thereto, and may be enforced accordingly.\n\n(4) All suits, actions, appeals and other legal proceedings instituted by or against the Tea Shakthi Main Project or Tea Shakthi Investment Project or any person as representing the Tea Shakthi Main Project or the Tea Shakthi Investment Project and pending on the day immediately preceding the date of commencement of this Act. shall be deemed with effect from the date of commencement of this Act, to be suits, actions, appeals or other legal proceedings instituted by or against the Fund and may be continued accordingly.\n\n(5) All judgments and orders made in favour of. or against the Tea Shakthi main Project or Tea Shakthi Investment Project or any person as representing the Tea Shakthi Main Project or the Tea Shakthi Investment Project and remaining unsatisfied on the day immediately preceding the date of commencement of this Act, shall be deemed with effect from the date of commencement of this Act, to be judgements and orders made in favour of. or against, the Fund and may be enforced accordingly.\n\n(6) All other rights, liabilities and obligations of the Tea Shakthi Main project and Tea Shakthi Investment Project other than the rights, liabilities and obligations referred to in subsection (3) on the day immediately preceding the date of commencement of this Act. shall be deemed with effect from the date of commencement of this Act, to be the rights, liabilities and obligations of the Fund.\n\nSinhala text to prevail in case of inconsistency.', b'# 5.\n\n(1) Except as provided in sub-section (2), the Board shall, in the exercise of its powers, the performance of its duties and the discharge of its functions, be subject to and act in accordance with such directions as the Minister may from time to time issue.\n\n(2) In the exercise of its powers, the performance of its duties and the discharge of its functions in relation to matters which fall under paragraphs\n\n- (b) to regulate the establishment and operation of tea factories including factories for the manufacture of instant tea;\n- (c) to regulate the sale of tea including the conduct of tea auctions;\n- (d) to regulate the export of tea and arrangements relating to its shipping and freight;\n- (e) to assist and encourage the marketing of tea in and outside Ceylon and to promote the demand for tea in the world markets;\n- (f) to conduct, assist and encourage scientific and technological research into, and investigations of, all problems and matters affecting the production and manufacture of tea, the control of diseases of tea and the improvement of the quality of tea, and to publish and disseminate information relating to the results of such research in its discretion;\n- (g) to conduct, assist and encourage research into the economic state of the tea industry including future economic trends in the industry in Ceylon and elsewhere;\n- (h) to facilitate the securing of supplies of machinery, equipment and other commodities needed for the development of the tea industry in Ceylon;\n- (i) to provide financial, advisory or other assistance to persons engaged in the growing or manufacture of tea;\n- (j) to safeguard the interests of the workers in the tea industry so as to foster increased performance as well as to ensure their economic and social well-being;\n- (k) to collect statistics from growers, manufacturers, dealers or other persons on any matter relating to the tea industry, and to publish such statistics in its discretion;\n- (l) to provide the necessary liaison between the tea industry and the departments of Government or State Corporations, in order to promote and co-ordinate action for the development of the tea industry in Ceylon.', b'# 2. Live-wood Termite Species Attacking Low Grown Tea\n\nThe most prevalent species of live-wood termites attacking tea in the low country are Glyptotermes dilatatus and Neotermes greeni. The former is commonly referred to as the ""Low-country Live-wood Termite"" (LCLWT) and is the most widely distributed of the two species. It attacks tea from sea level to an elevation of about 1,000 m a.m.sl. N. greeni is usually encountered in the upper elevations of the low country and also occasionally in the mid-country.']"
"What are the recommended fungicides and spraying schedules for controlling Red Rust disease in young and mature tea plants, and what are the potential benefits and limitations of using these chemical methods?","[b'# 3. Management of Red Rust', b'# 2.3 Chemical Methods\n\nThe following categories of fungicides, which have protective and curative mode of action, can be used to control the Blister Blight Disease in tea:\n\n1. Protective: Copper Fungicides\n2. Curative: Systemic Fungicides', b'# PROTECTION OF TEA FROM RED RUST DISEASE IN THE LOW COUNTRY\n\nThis Advisory Circular supersedes the Advisory Circular DM 4 Serial No 13/03 issued in August 2003 and related previous Advisory Circulars and links with Advisory Circular PU 2.', b'# 2.4 Management of Blister Blight in Nurseries\n\nSucculent stems and leaves of the nursery plants are attacked by blister blight, affecting the overall growth of the plants. Select cultivars resistant to blister blight for establishing a nursery (please refer Advisory Circular PN1). Avoid dense shade in nurseries during monsoonal weather. Spray fungicides, either individually or as alternative sprays using a knapsack sprayer, as recommended in Advisory Circular PU2. Apply copper fungicides and systemic fungicides.', b'# 5.4. Chemical Control\n\nChemical spraying should be used only when the signs of mite damages appear and the infestation stages of the mites are known:\n\nPlease refer Advisory Circular PU 4 for recommended acaricides and dosages.\n\nFor effective control of mites, spraying should be done to the undersurface of the foliage as well:\n\nSpraying in plucking fields should be carried out immediately after plucking:\n\nWhen fields sprayed with Sulphur; the green leaves should be bulked with ten times the amount of flush from unsprayed areas.\n\nTea Research Institute of Sri Lanka\n\nTalawakelle\n\n\nAll rights reserved. No part of this publication may be reproduced or transmitted in any form or by any means; including photocopying, recording, scanning or information storage and retrieval electronic or mechanical, system without the prior written permission from the Director; Tea Research Institute of Sri Lanka, Talawakelle.']"
How do the different cutting and fermentation processes in CTC tea production impact the flavor and quality of the final product?,"[b'# AN ACT TO PROVIDE FOR THE REGISTRATION OF TEA PLANTATIONS AND THE PROPRIETORS THEREOF; FOR THE REGISTRATION OF TEA MANUFACTURERS AND OF THE FACTORIES OPERATED BY THEM; FOR THE CONTROL OF THE PLANTING AND REPLANTING OF TEA, THE POSSESSION, SALE AND PURCHASE OF TEA, AND THE EXPORTATION OF TEA, TEA SEED AND SUCH PARTS OF THE TEA PLANT AS ARE CAPABLE OF BEING USED FOR PROPAGATION; FOR THE IMPOSITION OF AN EXPORT DUTY ON TEA; FOR THE ESTABLISHMENT OF A TEA ADVISORY BOARD; AND FOR MATTERS CONNECTED THEREWITH.', b'# Replacement of the long title of Act No. 51 of 1957.\n\n2. The long title of the Tea Control Act, No. 51 of 1957 (hereinafter referred to as the \xe2\x80\x9d principal enactment \xe2\x80\x9c) is hereby repealed and the following new long title substituted therefor:-\n\n\xe2\x80\x9d An Act to provide for the registration of tea plantations and the proprietors thereof; for the registration of tea manufacturers and of the factories operated by them; for the development and maintenance of tea plantations and tea factories and consequences for non-compliance with orders issued by the Controller; for the control of the planting and replanting of tea, the possession, sale and purchase of tea, and the exportation of tea, tea seed and such parts of the tea plant as are capable of being used for propagation; for the imposition of an export duty on tea; for the establishment of a tea advisory board; and for matters connected therewith or incidental thereto.\xe2\x80\x9d.', b'# Fermentation\n\nThe period of fermentation is generally shorter than with conventional manufacture, ranging from 1 hour 15 minutes to about 2 hours 10 minutes depending on the rate of fermentation of the leaf. It is possible to ferment the leaf on tables, by reducing the spread to 25 mm. Fermentation machines with a forced draught of air could be used, but it is also advisable to pass it first through a ball-breaker as this operation minimizes the formation of agglomerates which inevitably find their way into the off grades.', b'# 2. Amendment of section 5 of the Act, No. 52 of 1993.\n\nSection 5 of the Tea Research Board Act, No. 52 of 1993 (hereinafter referred to as the \xe2\x80\x9cprincipal enactment\xe2\x80\x9d) is hereby amended by the substitution for paragraph (a), of the following paragraph:\n\n\xe2\x80\x9c(a) to conduct, assist and encourage scientific and technological research in, and investigations of, all matters pertaining to the production and manufacture of tea, including the prevention and control of diseases and pests affecting tea, conservation of soil in tea lands, quality of fertilizer used, maintaining the quality of tea planting material, assessing and dealing with the impact of climate change and diversification of tea products; and to disseminate and publish at its discretion, the results of such research to the Tea Small Holdings Development Authority established by the Tea Small Holdings Development Law, No. 35 of 1975, to tea small holders, large scale estate sector and to other stakeholders;\xe2\x80\x9d', b'# MANUFACTURE OF TEA BY THE CTC PROCESS\n\nThis Advisory Circular replaces Circular Nos. T3, Serial No. 11/72 and T4, Serial No. 12/72)\n\nA satisfactory liquoring standard is important for good CTC manufacture; not only to ensure teas of a high standard of plucking but also to prevent the CTC rollers from becoming prematurely blunt by cutting into coarse leaf, stalk and woody material.']"
Under which clause of the act provides the Tea Commissioner to Reasonable price ?,"[b'# (h)\n\nall sums accepted by the Tea Commissioner by the compounding of offences under the Tea Control Act, No. 51 of 1957, or the Tea (Tax and Control of Export) Act, No. 16 of 1959; and', b'# Central Tea Fund\n\nThere shall be established a Fund to be called ""the Central Tea Fund"". There shall be paid into that Fund:\n\n1. all sums lying, on the appointed date, to the credit of the Tea Control Fund;\n2. all sums lying, on the appointed date, to the credit of the Tea Subsidy Fund;\n3. all sums lying, on the appointed date, to the credit of the Ceylon Tea Propaganda Board;\n4. all sums lying, on the appointed date, to the credit of the Tea Research Board;\n5. the proceeds of \xe2\x80\x93\n1. all export duties on tea imposed under this Act,\n2. all fees levied and collected in respect of licences and permits issued under this Act or the Tea Control Act, No. 51 of 1957, or the Tea (Tax and Control of Export) Act, No. 16 of 1959, or in respect of dealings in tea under any other written law,\n3. the sale of seed, cuttings, plants and fertilizers by the Tea Commissioner to proprietors of estates and small holdings;\n6. such sums as may from time to time be granted by resolution of the House of Representatives for the purposes of this Act;\n7. all sums accepted by the Tea Commissioner by the compounding of offences under the Tea Control Act, No. 51 of 1957, or the Tea (Tax and Control of Export) Act, No. 16 of 1959; and\n8. all such other sums as may accrue to the Board by the sales of property belonging to the Board, gifts, and income from investments or otherwise.\n\n(2) There shall be paid out of the Central Tea Fund such sums as may be authorized by the Board for the purpose of meeting expenditure incurred in the exercise, discharge and performance of its powers, functions and duties under this Act, including:\n\n1. the remuneration of all officers and servants employed by the Board for carrying out the provisions of this Act and all other expenses of the administration of this Act;\n2. the sums approved by the Board for the purpose of providing financial assistance, by way of grant or loan, for the planting of tea, for the replanting and the rehabilitation of estates and small holdings, for the diversification of estates and small holdings by the replacement of tea on such estates and small holdings with other crops or livestock farming, for the marketing of the green.', b'# Tea Commissioner.', b'# Amendment of section 8 of A No. 81 of 1957.\n\n2. Section 8 of the Tea Control Act, No. 15 of 1957 (here in after referred to as the ""principal enactment"") is hereby amended, by the repeal of subsection (2) of that section and substitution, therefor of the following subsection:\n\n\xe2\x80\x9d (2) Where the Controller is satisfied, after such inquiry as he may deem necessary:\n\n- (a) that the building, or equipment, or manner of operation, of any tea factory is not of standard conducive to the manufacture of made tea of good quality; or\n- (b) that the owner of a tea factory has paid for green tea leaf bought by him for manufacture at such factory a price lower than the reasonable price payable as determined by the Controller having regard to the price fetched for made tea manufactured at that factory; or\n- (c) that the owner of a tea factory has delayed payment of the reasonable price, referred to in paragraph (b) for green tea leaf bought by him for manufacture at that factory,\n\nthe Controller may suspend or cancel where necessary, the registration of such tea factory or\n\n- (i) in any case referred to in paragraph (b), direct any broker to whom the owner of such tea factory has sold any made tea manufactured at that factory, to deduct from the proceeds of such sale, an amount equivalent to the difference between the reasonable price for green tea leaf as determined by the Controller and the actual price paid by such owner for the green tea leaf bought by him;\n- (ii) in any case referred in paragraph (c), direct any broker to whom the owner of such tea factory has sold any made tea manufactured at that factory, to\ndeduct from the proceeds of such sale, an amount equivalent to the reasonable price determined by the Controller for such green tea leaf,\n\nand to remit the sum so deducted to him, for payment by him, to the person supplying such green leaf to such factory.\xe2\x80\x9d.', b'# following new definition:\n\n\xe2\x80\x9d Commissioner \xe2\x80\x9d means the person appointed to be or to act as Tea Commissioner for the purposes of the Ceylon Tea Board Act;']"
"How does the Tea, Rubber and Coconut (Control of Fragmentation) Board regulate the division of tea, rubber, and coconut estates?","[b'# Tea Subsidy Fund. [\xc3\x82\xc2\xa7 3, 66 of 1961.]\n\n2.\n\n(1) There shall be established a Fund called the Tea Subsidy Fund.\n\n(2) The object of the Fund shall be to subsidize-\n\n- (a) the replanting of tea estates and tea small holdings;\n- (b) the replanting of rubber estates and rubber small holdings;\n- (c) the rehabilitation of tea estates and tea small holdings;\n- (d) the marketing of green tea leaf of tea estates and tea small holdings; and\n- (e) the manufacture of made tea from such green tea leaf.', b'# Amendment of section 17 of the principal enactment.\n\n8. Section 17 of the principal enactment is hereby amended as follows :-\n\n(1) in subsection (1) of that section \xe2\x80\x93\n\n- (a) by the substitution in paragraph (a) of that subsection for all the words from \xe2\x80\x9cfrom the moneys of the Tea Control Fund\xe2\x80\x9d to the end of that paragraph, of the words \xe2\x80\x9cfrom the Capital Fund notwithstanding anything to the contrary in the Sri Lanka Tea Board Law, No. 14 of 1975,\xe2\x80\x9d;\n- (b) by the substitution in paragraph- (b) of that subsection for the words \xe2\x80\x9cRubber Control Act, and\xe2\x80\x9d, of the words \xe2\x80\x9cRubber Control Act;\xe2\x80\x9d;\n- (c) by the insertion immediately after paragraph (b) of that subsection, of the following new paragraph :-\n\n\xe2\x80\x9c(bb) where such meeting, investigation or report is concerned with an application made to the Board relating solely to a coconut estate, be defrayed from the moneys of the Coconut Development Authority notwithstanding anything to the contrary in the Coconut Development Act, No. 46 of 1971, and\xe2\x80\x9d;\n\n- (d) by the substitution for paragraph (c) of that subsection, of the following paragraph :-\n\n\xe2\x80\x9c(c) where such meeting, investigation or report is concerned with an application made to the Board relating jointly to a tea, a rubber and a coconut estate or relating partly to one and partly to another of such estates, be defrayed from the moneys lying to the credit of the Fund established by section 12A of this Act.\xe2\x80\x9d, and\n\n(2) by the repeal of subsection (2) of that section and the substitution therefor, of the following subsection :-\n\n\xe2\x80\x9c(2) The emoluments of the Secretary and other officers and servants appointed by the Board shall be paid out of the Fund established by section 12A of this Act.\xe2\x80\x9d.', b'# Short title.\n\n1. This Act may be cited as the Tea and Rubber Estates (Control of Fragmentation) Act, No. 2 of 1953.', b'# Short title.\n\n1. This Act may be cited as the Tea and Rubber Estates (Control of Fragmentation) (Amendment) Act, No. 20 of 2005.', b'# Prohibition of registration of certain estates and small holdings under the Tea Control Act and the Rubber Control Act.']"
What is the minimum deposit the exporter should keep at the Sri Lanka Tea Board?,"[b'# Sri Lanka Tea Board', b'# SRI LANKA TEA BOARD', b'# SRI LANKA TEA BOARD', b'# SRI LANKA TEA BOARD', b'# SRI LANKA TEA BOARD']"
How does the formula calculate a reasonable price for a High Grown factory ?,"[b'# Price', b'# Circular Letter to M [pL.74\n\nSri Lanka Tea Board\n\nTea Commissioner & Division\n\nP.O. Box\n\nCOLOMBO 01 - 363,\n\n10th April 1987\n\nDear Sir/Madam,\n\nPayment of Reasonable Price for Green Leaf purchased by Tea Factories\n\n17th June; Your kind attention is drawn to circular letters No. M [BL.64 of 1935 and W/BL.66 of 2nd 1985 regarding the calculation of the reasonable price payable for green tea leaf that the formula for sharing the sales proceeds between the factory owners and green leaf suppliers be revised as follows;\n\n1. 32% to the factory owners as manufacturing charges\n2. 68% to the green leaf suppliers\n\nThe above revision has been made to take effect from 1st April, 1987 in view of the steep increase in the monthly net elevational average applicable to the calculation of the incentive when the net sale average is more than the price of green leaf to made tea will remain unchanged. The rates of conversion formula examples on calculation of the reasonable price according to the revised are shown overleaf.\n\nTea Factories on and after 1st April, 1987. The formula will take effect for the payment of green leaf purchased by.\n\nPlease acknowledge receipt of this Circular letter.\n\nYour faithfully,\n\nSgd. R.L. WEERASEKERA\n\nActg. TEA COMMISSIONER.\n\nCopy to:\n\n1. s/p.I.\n2. Director General, S.L.TB\n3. Chief Internal Auditor, S.L.TB.\n4. General Manager TSHDA JEDB /SLSPc /LRC\n5. All Assistant Tea Commissioners\n6. All Field Officers.', b'# Manufacture of Tea\n\nYour attention is drawn to Circular Letter Mo.M/BL.67 dated 31st December 1985.\n\nDespite attempts to improve, it is observed that the net quality of teas manufactured by improving the standard of processing; January 1986 rate in your factory average price for the month of the Colombo Auctions has been below the relevant elevational average.\n\nHence, with the urge to stress again that unless remedial action of teas produced and higher price is initiated, the standard reluctantly compelled will take appropriate action as Remedial necessary under the provisions of the Tea Control Act.\n\nPlease acknowledge receipt of this letter.\n\nYours faithfully,\n\nSigned - G. de Silva,\n\nDIRECTOR, Rli2\n\nCopy to:\n\n- The Director General, Sri Lanka Tea Board\n- Internal Auditor, Sri Lanka Tea Board\n- The Secretary, Planters Association\n- All Field Officers', b'# (e)\n\nby the substitution in the definition of the term \xe2\x80\x9d tea factory \xe2\x80\x9c, for the expression \xe2\x80\x9d made tea; \xe2\x80\x9c, of the expression \xe2\x80\x9d made tea or for the production of instant tea.\xe2\x80\x9d', b'# 3.7\n\nAvoid operating the factory under-capacity.']"
