question,ranked_chunks
What types of tree species are recommended for establishing shelter belts in tea plantations in different regions?,"[b'# SHELTER BELT TREE SPECIES AND RECOMMENDED SPACING', b'# SQIs for different tea growing regions\n\nAccordingly, recommended SQIs for tea lands in different tea growing regions have been established, considering the aforesaid parameters of the rehabilitated fields and neighboring fields earmarked for up-rooting, as given in Table 2.', b'# 3. Integrated Management of Nematodes in Young Tea\n\nPlant parasitic nematodes affecting tea could be disseminated through planting materials, soil, water and agricultural implements etc. In the presence of a susceptible root system of a good host, the residual nematode populations may get developed. Hence, nematodes once introduced to fields, they cannot be eradicated. Further, all tea growing areas are declared as nematode active or prone areas due to evidences on presence of either of the above three species. Therefore, every attempt should be taken for integrated management of nematodes by adhering to the following measures in young tea:\n\n- a. The area should be planted to rehabilitation grasses; Mana or Guatemala for a minimum period of 2 years. Mana is recommended to all tea growing areas. In areas where the tea has been found to be infested with the burrowing nematode, Radopholus similis, Guatemala grass is not recommended as it is a good host. The C03 (Hybrid Napier grass- Pennisetum purpureum X P. minimum of americarnum) grass is recommended for lands with no months of rehabilitation as the biomass production is comparatively high (Please refer to Advisory Circular PM 12).\n- b. Use of nematode free and healthy planting materials of recommended cultivars to the region for field planting (please refer to Advisory Circulars PN 1 on Suitability of Tea Clones for the Different Regions and PN 2 on Good Nursery Management Practices).\n- c. Adopt all Good Agricultural Practices (GAPs) recommended by TRI to ascertain healthy and vigorous plant growth.\n- d. Prophylactic chemical treatments to bring down any residual plant parasitic nematode populations ensuring to avoid invasion to tea roots of the newly introduced tea plants as described under section 4.', b'# Region-specific species', b'# 1. Introduction\n\nDiseases, insect, mite and nematode pests and weeds occur in tea, in different stages of the crop, and at different times of the year. Therefore an integrated approach (Integrated Pest Management: IPM) is recommended for efficient and timely management of pests in tea, which consists of various agronomic, cultural, biological and chemical strategies in a rational and environmentally friendly manner: Rational use of fungicides, insecticides, acaricides, nematicides, and weedicides is part of integrated management of diseases; insects, mites, nematodes and weeds respectively.\n\nIn parallel, it is necessary to strengthen biological systems and improve cultural practices in order to promote the build-up of tolerance in plant and biological-control organisms in the environment; and to prevent the introduction and dissemination of pests, diseases and weeds in tea fields. Also, use of tea cultivars resistant / tolerant to the different diseases and pests is the prime component in the IPM:\n\nAs tea is a food commodity for human consumption, there is a growing concern among health-conscious consumers on pesticide residues that may be present in tea. Therefore, it is advisable to use pesticides in tea fields carefully, in order to minimize the residues in made tea, effects on workers and non-target organisms in the eco-system: Moreover; the cost-effectiveness and the social acceptance of pesticide usage also have to be considered for the sustainability of the tea industry:\n\nThe chemicals and their use in tea as Plant Protection Products (PPPs) are subjected to change periodically to meet the requirements of consumers, social and environmental acceptance etc. It is extremely necessary to ensure that the pesticide residues in made tea at levels below the Maximum Residue Limits (MRLs) set for different pesticides by different countries.\n\nWhen PPPs are applied to tea cultivations, it is necessary to strictly adhere to specific Pre-Harvest Intervals (PHI) and bulk green leaf from the sprayed and unsprayed fields or made tea at a ratio of keeping and monitoring on rational use of the PPPs are made mandatory for traceability and regulatory purposes: This would help dilute and minimize the pesticide residues in the made tea. Proper record keeping is essential.']"
What are the current outturn percentages used to calculate the reasonable price payable for green leaf purchased by tea factories in Sri Lanka?,"[b'# SRI LANKA TEA BOARD', b'# (c)\n\nby the insertion, immediately after the definition of the term \xe2\x80\x9d green tea leaf \xe2\x80\x9c, of the following new definition:\n\n\xe2\x80\x9d instant tea \xe2\x80\x9d means any food product soluble in water made entirely or principally from made tea or green tea leaf;', b'# Payment of Reasonable Price for Green Leaf Purchased by Tea Factories\n\nYour kind attention is drawn to my circular letter No TCMR/Z of 29th July 2009 under the same subject. The Sri Lanka Tea Board had its meeting held on 01st November 2010 and has decided to use monthly elevational average based on their registered processing methods for computation and payment of reasonable price for green tea leaf in the following manner:\n\n- Tea Factories manufactured only orthodox tea should use monthly elevational sales average for orthodox tea.\n- Tea Factories manufactured only CTC tea should use monthly elevational sales average for CTC tea.\n- Tea Factories manufactured as dual CTC and Orthodox manufacturers should use combined elevational sales average for Orthodox and CTC.\n- Tea Factories engaged in manufacture of Green tea and Organic tea should use Orthodox elevational sales average.\n\nNonecompliances of the above directives shall be an offence under the Section 82 of the Tea Control Act No. 51 of 1957 as amended and will be liable to appropriate legal action against the offended registered manufacturers of tea.\n\nPlease acknowledge the receipt of this circular letter.\n\nYours truly,\n\nT{8 Jayantha Edirisinghe\n\nActing Tea Commissioner', b'# Payment of Reasonable Price for Green Leaf Purchased by Tea Factories\n\nReference is requested to my Circular Letter No. NE/6L.57 of 8th March 1983. The Government has decided to increase the Manufacturing Charges on made tea in respect of factories, which realize a monthly nett sale average of Rs. 21/20 and above. The Manufacturing Charges allowed in respect of factories obtaining a monthly nett sale average of Rs. 18/45 and less will be limited to Rs. 4/50 per kilogramme of made tea while the amount remaining after the payment of Rs. 21/20 will be allowed to appropriate manufacturing charges on the balance of green leaf at a price of Rs. 3/10 per kilogramme.', b'# AN ACT TO PROVIDE FOR THE REGISTRATION OF TEA PLANTATIONS AND THE PROPRIETORS THEREOF; FOR THE REGISTRATION OF TEA MANUFACTURERS AND OF THE FACTORIES OPERATED BY THEM; FOR THE CONTROL OF THE PLANTING AND REPLANTING OF TEA, THE POSSESSION, SALE AND PURCHASE OF TEA, AND THE EXPORTATION OF TEA, TEA SEED AND SUCH PARTS OF THE TEA PLANT AS ARE CAPABLE OF BEING USED FOR PROPAGATION; FOR THE IMPOSITION OF AN EXPORT DUTY ON TEA; FOR THE ESTABLISHMENT OF A TEA ADVISORY BOARD; AND FOR MATTERS CONNECTED THEREWITH.']"
"How does the Sri Lanka Tea Board ensure the quality of tea produced in Sri Lanka, and what measures does it take to promote the industry?","[b'# Sri Lanka Tea Board', b'# Sri LANKA TEA BOARD', b'# SRI LANKA TEA BOARD', b'# Sri Lanka Tea Board', b'# Sri Lanka Tea Board']"
When the parliament passed the Tea Commissioner's Act and how many times it got amended?,"[b'# Appointment of Commissioner and other officers and servants.\n\n13. There may be appointed for the purposes of this Act-\n\n- (a) a person, by name or by office, to be or to act as the Commissioner of Tea Exports; and\n- (b) such other officers and servants as may be required for the purpose of carrying out the provisions of this Act.', b'# AN ACT TO AMEND THE NATIONAL INSTITUTE OF PLANTATION MANAGEMENT ACT, NO. 45 OF 1979.\n\nBE it enacted by the Parliament of the Democratic Socialist Republic of Sri Lanka as, follows :\n\n[29th December, 1981]', b'# PARLIAMENT OF THE DEMOCRATIC SOCIALIST REPUBLIC OF SRI LANKA', b'# PARLIAMENT OF THE DEMOCRATIC SOCIALIST REPUBLIC OF SRI LANKA', b'# AN ACT TO AMEND THE SRI LANKA TEA BOARD LAW, NO. 14 OF 1975\n\nBE it enacted by the Parliament of the Democratic Socialist Republic of Sri Lanka as follows :-\n\n[15th October, 2003]']"
What are the recommended fertiliser mixtures for young tea seed bearers in their first two years of growth?,"[b'# 1.0 Fertiliser mixtures for young tea seed bearers', b'# 4. Length of pruning cycle\n\nThe lengths of pruning cycle recommended for different tea growing regions are:\n\n|Region|Seedling|VP|\n|---|---|---|\n|Low country|2 years|3 years|\n|Mid-country (wet zone)|3 - 4 years|4 - 5 years|\n|Mid-country (Intermediate zone) or Uva|3 - 4 years|4 - 5 years|\n|Up country|3 - 4 years|4 - 5 years|', b'# AN ACT TO PROVIDE FOR THE REGISTRATION OF TEA PLANTATIONS AND THE PROPRIETORS THEREOF; FOR THE REGISTRATION OF TEA MANUFACTURERS AND OF THE FACTORIES OPERATED BY THEM; FOR THE CONTROL OF THE PLANTING AND REPLANTING OF TEA, THE POSSESSION, SALE AND PURCHASE OF TEA, AND THE EXPORTATION OF TEA, TEA SEED AND SUCH PARTS OF THE TEA PLANT AS ARE CAPABLE OF BEING USED FOR PROPAGATION; FOR THE IMPOSITION OF AN EXPORT DUTY ON TEA; FOR THE ESTABLISHMENT OF A TEA ADVISORY BOARD; AND FOR MATTERS CONNECTED THEREWITH.', b'# DROUGHT MITIGATION IN TEA PLANTATIONS\n\n(This circular cancels the circular No. PA 2 serial No. 2/01 issued in January 2001)\n\nDrought is a serious environmental hazard. Its damage to cultivated crops has become frequent in the recent past and tea is no exception. Most of the tea growing regions in Sri Lanka receive rains from both north-east and south-west monsoons. However, tea plantations are adversely affected by moisture stress conditions due to uneven distribution of rainfall within the year. The main dry period in most of the tea growing regions extends from early January to about late March. However, those areas which receive mainly the north-east monsoon rains, viz. Uva and some parts of the Low and Mid country, have the rain dry period generally extending from late June to about early September.\n\nDuring these dry months, considerable damage can be caused to both young and mature tea, with extensive casualties being observed in young clonal tea during their first and the second year after planting. In order to minimize such damage and ensure early recovery, the following precautionary measures need to be adopted prior to, and following, a drought. The drought effects differ with the growth stage of tea, that is whether it is young tea (before first pruning) or mature tea (after first pruning). Hence drought mitigation measures also should vary according to the stage of growth of the tea.', b'# 1.0 Introduction\n\nTwo nursery mixtures, viz. T65 MAP (containing mono-ammonium phosphate) and T65 DAP (containing di-ammonium phosphate), are recommended differing only in the source of phosphate. The option to have two P fertiliser sources is to allow the grower to use either source depending on its availability in the market. When both mixtures are available, T65 MAP is preferred as it is easier to handle because it dissolves faster.']"
"What are the procedures for registering a Customs Goods Declaration (CUSDEC) form for tea exports in Sri Lanka, and what are the requirements for pre-shipment sampling?","[b'# Sri Lanka Tea Board Standards for ""Sri Lanka Origin Teas""', b'# Sri Lanka Tea Board Standards for ""Sri Lanka Origin Teas""', b'# AN ACT TO PROVIDE FOR THE REGISTRATION OF TEA PLANTATIONS AND THE PROPRIETORS THEREOF; FOR THE REGISTRATION OF TEA MANUFACTURERS AND OF THE FACTORIES OPERATED BY THEM; FOR THE CONTROL OF THE PLANTING AND REPLANTING OF TEA, THE POSSESSION, SALE AND PURCHASE OF TEA, AND THE EXPORTATION OF TEA, TEA SEED AND SUCH PARTS OF THE TEA PLANT AS ARE CAPABLE OF BEING USED FOR PROPAGATION; FOR THE IMPOSITION OF AN EXPORT DUTY ON TEA; FOR THE ESTABLISHMENT OF A TEA ADVISORY BOARD; AND FOR MATTERS CONNECTED THEREWITH.', b'# Replacement of the long title of Act No. 51 of 1957.\n\n2. The long title of the Tea Control Act, No. 51 of 1957 (hereinafter referred to as the \xe2\x80\x9d principal enactment \xe2\x80\x9c) is hereby repealed and the following new long title substituted therefor:-\n\n\xe2\x80\x9d An Act to provide for the registration of tea plantations and the proprietors thereof; for the registration of tea manufacturers and of the factories operated by them; for the development and maintenance of tea plantations and tea factories and consequences for non-compliance with orders issued by the Controller; for the control of the planting and replanting of tea, the possession, sale and purchase of tea, and the exportation of tea, tea seed and such parts of the tea plant as are capable of being used for propagation; for the imposition of an export duty on tea; for the establishment of a tea advisory board; and for matters connected therewith or incidental thereto.\xe2\x80\x9d.', b'# Registration\n\nAs an exporter of tea\n\n|Fresh application|Rs. 5000/=|\n|---|---|\n|Renewal of Export License fee, annually for registered exporters of tea|Rs. 500/=|\n|Customs Goods Declaration - CUSDEC Form Lodgement Registration fee|Rs. 100/=|\n|Issue of permit to import tea under the regulations|Rs. 500/=|\n|Issue of certificates|Rs. 250/= per certificate|\n|Sale of applications for import re-export under the regulation|Rs. 20/= per set|\n|Private Sale Ratification fee for tea|Rs. 100/= per each grade|']"
When was the last amendment made to the Tea Control Act ? 2024,"[b'# Tea Control (Amendment)', b'# Short title.\n\n1 This Act may be cited as the Tea Control (Amendment) Act.', b'# 33. Estimates of the income and expenditure of the Tea Control Fund.\n\n(1) The Controller shall, forthwith after the appointed date, transmit to the Minister estimates of the income likely to accrue to, and the expenditure likely to be incurred out of, the Tea Control Fund during the period commencing on the appointed date and ending on the last day of the year in which the appointed date occurs.\n\n(2) The Controller shall transmit to the Minister, not later than the fifteenth day of November in each year, estimates of the income likely to accrue to, and the expenditure likely to be incurred out of, the Tea Control Fund in the next succeeding year:\n\nProvided, however, that where this Act comes into operation after the last day', b'# Short title.\n\n1. This Act may be cited as the Tea (Tax and Control of Export) (Amendment) Act, No. 51 of 1985.', b'# Definitions\n\n\xe2\x80\x9d Minister \xe2\x80\x9d means the Minister in charge of the Ministry of Commerce and Trade;\n\n\xe2\x80\x9d Minister of Agriculture \xe2\x80\x9d means the Minister in charge of the Ministry of Agriculture;\n\n\xe2\x80\x9cPrincipal Collector \xe2\x80\x9d means the person appointed to be or to act as the Principal Collector of Customs;\n\n\xe2\x80\x9d refuse tea \xe2\x80\x9d has the same meaning as in the Tea Control Act, No. 51 of 1957, as amended by this Act;\n\n\xe2\x80\x9d rehabilitation \xe2\x80\x9c, when used with reference to any tea estate or tea small holding, means any operation designed to improve the agricultural conditions of such estate or small holding, and includes the application of fertilizers, the adoption of soil conservation measures and the planting of additional tea plants and any other suitable plants in such estate or small holding;\n\n\xe2\x80\x9d replanting \xe2\x80\x9c, when used with reference to any tea estate or tea small holding, means the uprooting of all existing tea plants and other vegetation in the whole or any part of such estate or small holding and their replacement by new tea plants, and includes the planting of tea plants in an area which does not form part of such estate or small holding if the tea plants in an equivalent area of such estate or small holding are eradicated within such time as the Board may specify;\n\n\xe2\x80\x9d small holding \xe2\x80\x9d has the same meaning as in the Tea Control Act, No. 51 of 1957, as amended by this Act;\n\n\xe2\x80\x9d tea \xe2\x80\x9d has the same meaning as in the Tea Control Act, No. 51 of 1957, as amended by this Act;\n\n\xe2\x80\x9cTea Commissioner \xe2\x80\x9d means the person appointed to be or to act as Tea Commissioner for the purposes of this Act;\n\n\xe2\x80\x9d Tea Control Fund \xe2\x80\x9d means the Tea Control Fund established under the Tea Control Act, No, 51 of 1957, as amended by this Act;\n\n\xe2\x80\x9d tea factory \xe2\x80\x9chas the same meaning as in the Tea Control Act, No. 51 of 1957, as amended by this Act;\n\n\xe2\x80\x9d Tea Research Board \xe2\x80\x9d means the Board of the Tea Research Institute of Ceylon established under the Tea Research Ordinance;\n\n\xe2\x80\x9cTea Subsidy Fund \xe2\x80\x9d means the Tea Subsidy Fund established under the Tea Subsidy Act, No. 12 of 1958.']"
How do regulatory bodies in Sri Lanka monitor and control the disposal of damaged tea due to natural causes or other factors?,"[b'# Damaged Made Tea due to Natural Causes and otherwise\n\nThe Sri Lanka Tea Board observes that owners of made tea, in various stages of the disposal channels manage to minimize their losses, due to damages caused to made tea on account of natural causes or otherwise through insurance covers. This loss recovery mechanism culminates with the releasing of a considerable volume of damaged teas, to the export blends through unscrupulous parties. This has tarnished the image of Ceylon Tea abroad, damaging the reputation established by the exporters, over decades of hard work.\n\nConsidering the adverse repercussion of the said unethical trading practice, it has decided to monitor such transactions, with immediate effect.\n\nWhere any tea is damaged due to natural causes and otherwise that will deem the said tea unfit for sale through approved channels or otherwise, shall be declared by the registered exporter, manufacturer or produce broker to the Sri Lanka Tea Board, within a period of one week from the said incident:\n\nSpecimen Form for this purpose is annexed.\n\nNo such teas should be released to an insurance company or its agent or any other person without the prior written consent of the Sri Lanka Tea Board.\n\nSgdodo\n\nTelephone: 2583687\n\nFax: 2582122\n\nPO.Box: 2589132\n\nHotLine: 2587814\n\nEmail: teaboard@pureceylontea.com\n\nWeb Site: www.pureceylontea.com\n\nTelegrams: TEABOARD, COLOMBO', b'# CEYLON TEA\n\nGalle Road, Colombo 03, Sri Lanka\n\nCircular No. OR/1/51\n\n05th July 2010.\n\nTo: Chief Executive Officer/Managing Director of Registered Exporters of Tea\n\nRegistered Manufacturers of Tea\n\nLicensed Produce Brokers of Tea\n\nSir,\n\nDamaged Made Tea due to Natural Causes and otherwise\n\nThe Sri Lanka Tea Board observes that owners of made tea, in various stages of the disposal channels manage to minimize their losses, due to damages caused to made tea. This mechanism culminates with the releasing of a considerable volume of damaged teas; on account of natural causes or otherwise through insurance covers. This loss recovery which are either contaminated with microbiological elements or chemical substances in to tea export blends through unscrupulous parties. This has tarnished the image of \'Ceylon Tea\' abroad, damaging the reputation established by the exporters, over decades of hard work.\n\n02. Considering the adverse repercussion of the said unethical trading practice, it has been decided to monitor such transactions, with immediate effect:\n\n03. Where any tea is damaged due to natural causes and otherwise that will deem the said tea unfit for sale through approved channels or otherwise, shall be declared by the registered exporter, manufacturer or produce broker to the Sri Lanka Tea Board, within a period of one week from the said incident. Such teas should be released to an insurance company or its agent or any other person without the prior written consent of the Sri Lanka Tea Board.\n\n2582121 Ordd Oe.0o: 1750 0\n\n5lI@uGud 2682122 2589132 B. Gu: 568 QeEri(u"" !\n\nTelephone 2583687 Fax P.o.Box Telenrame\nliable to be suspended\n\n04. In the case of any party failing to comply with this directive, its2 -\n\nPlease acknowledge receipt of this Circular:\n\nYours truly,\n\nDirector General\n\nHD Hemaratne\n\nSri Lanka Tea Board\n\nCopy:\n\n|1|Chairman, Insurance Board of Sri Lanka.|\n|---|---|\n|4.32.|Chairman, Colombo Brokers Association.|\n| |Chairman, Tea Exporters Association:|\n| |Chairman, Colombo Tea Traders Association.|\n|7.6.5.|Chairman, Association of|\n| |Chairman, Private Tea Factory Owners Association.|\n| |Chairman, The Planters Association of Ceylon.|\n|8.|Acting Tea Commissioner. Small & Medium Exporters of Tea:|\n| |Director Tea Promotion, TPD.|\n|9|12. Managing Directors/CEOs of all Insurance Companies.|\n| |11.10 Deputy Director (Tech.) Tea Tasting Unit;|\n| |Assistant Director (Lab):|\n| |Deputy Tea Commissioner (Exports)|', b'# SRI LANKA TEA BOARD', b'# SRI LANKA TEA BOARD', b'# SRI LANKA TEA BOARD']"
